{
  "schemaVersion": "1.0",
  "id": "wf_review_chapter",
  "type": "workflow.definition",
  "title": "审稿当前章节",
  "status": "active",
  "entryStepId": "step_build_context",
  "steps": [
    {
      "id": "step_build_context",
      "kind": "context",
      "nextStepId": "step_review"
    },
    {
      "id": "step_branch",
      "kind": "branch",
      "branches": [
        {
          "id": "needs_revision",
          "label": "Needs revision",
          "condition": "review.severity >= medium",
          "nextStepId": "step_rewrite"
        },
        {
          "id": "ready_to_save",
          "label": "Ready to save",
          "condition": "review.severity < medium",
          "nextStepId": "step_save"
        }
      ],
      "defaultNextStepId": "step_save"
    },
    {
      "id": "step_review",
      "kind": "agent",
      "agentId": "agent_reviewer_default",
      "nextStepId": "step_branch"
    },
    {
      "id": "step_rewrite",
      "kind": "agent",
      "agentId": "agent_writer_default",
      "nextStepId": "step_save"
    },
    {
      "id": "step_save",
      "kind": "save"
    }
  ],
  "createdAt": "2026-07-03T00:00:00.000Z",
  "updatedAt": "2026-07-03T00:00:00.000Z"
}
